{
  "schema": "prismora.experiment/v2",
  "experiment_id": "strategy-quadratic-mock",
  "title": "Interface smoke test: quadratic strategy matrix",
  "description": "Synthetic data only. This validates planning, storage, inspection and comparison; it is not scientific evidence.",
  "tags": ["mock", "smoke-test"],
  "hypothesis": {
    "primary": "The laboratory executes a deterministic matrix and preserves complete provenance.",
    "falsifiers": ["A planned run cannot be reproduced from its request and hashes."],
    "exploratory": []
  },
  "preregistration": {"status": "draft", "locked_at": null, "spec_sha256": null, "amendments": []},
  "models": [
    {
      "alias": "MOCK01",
      "model_id": "mock/12-layer-lab-model",
      "backend": "mock",
      "blind_alias": "MOCK01",
      "organization": "Prismora",
      "origin_region": "Synthetic",
      "model_type": "unknown",
      "revision": "mock-v1",
      "tokenizer_revision": "mock-tokenizer-v1",
      "lens_id": "mock-lens",
      "lens_revision": "mock-lens-v1",
      "precision": "synthetic",
      "quantization": null,
      "metadata": {"scientific_use_forbidden": true}
    }
  ],
  "prompts": [
    {
      "prompt_id": "operations_only",
      "chat": [
        {"role": "user", "content": "Solve x^2 - 5x + {{constant}} = 0. Show only algebraic operations."}
      ],
      "metadata": {}
    }
  ],
  "matrix": {"factors": {"constant": [5, 6, 7]}, "bindings": {}, "repeats": 1},
  "generation": {"temperature": 0, "max_new_tokens": 24, "seed": 1, "prepend_bos": true, "enable_thinking": false, "frequency_penalty": 0},
  "readout": {"types": ["JACOBIAN_LENS", "LOGIT_LENS"], "top_k": 8, "filter_nonword_tokens": true, "exclude_first_n_positions": 0},
  "intervention": null,
  "analysis": {
    "primary_metric": "pipeline_integrity",
    "secondary_metrics": ["top1_agreement_by_layer"],
    "exclusions": [],
    "compare_absolute_and_relative_depth": true,
    "semantic_families": {},
    "generated_positions_only": true,
    "presence_min_probability": 0.01,
    "notes": "Synthetic backend only."
  },
  "stopping_rule": "Run all three synthetic conditions.",
  "metadata": {"mock": true}
}
